{
  "@timestamp": "2026-10-23T05:30:02.000Z",
  "ecs.version": "8.11.0",
  "event": {
    "action": "http.request.completed",
    "dataset": "http.access",
    "duration": 25000000,
    "id": "55555555-6666-4777-8888-999999999999",
    "outcome": "success"
  },
  "http": {
    "request": {
      "method": "GET"
    },
    "response": {
      "status_code": 200
    },
    "route": "/api/v1/users/:userId"
  },
  "log": {
    "level": "info"
  },
  "message": "GET /api/v1/users/:userId completed with status 200",
  "service": {
    "environment": "production",
    "name": "gateway-api"
  },
  "skyra": {
    "duration_ms": 25.0,
    "project_id": "skyra-gateway",
    "schema_version": "1.0"
  },
  "trace": {
    "id": "4bf92f3577b34da6a3ce929d0e0e4736"
  }
}
