{
  "@timestamp": "2026-10-23T05:30:00.000Z",
  "ecs.version": "8.11.0",
  "event": {
    "action": "user.login",
    "dataset": "auth.audit",
    "id": "11111111-2222-4333-8444-555555555555",
    "outcome": "success"
  },
  "log": {
    "level": "info"
  },
  "message": "User authenticated successfully",
  "service": {
    "environment": "production",
    "name": "auth-service"
  },
  "skyra": {
    "project_id": "skyra-portal",
    "schema_version": "1.0"
  }
}
